{
  "akepVersion": "0.1",
  "clientUsageId": "agent-run-0198/usage-1",
  "exposureReceiptId": "urn:uuid:0198a1d2-82d5-7b43-8d2d-6af93e78c010",
  "spaceId": "https://knowledge.example/spaces/support",
  "citations": [
    {
      "citationId": "urn:uuid:0198a1d2-82d5-7b43-8d2d-6af93e78c002",
      "revisionId": "urn:akep:sha256:645b377464b2d9886f2567066e7d932156b2435df8fcc8d0790e5720129e430d",
      "payloadDigest": "sha256:2cf24dba5fb0a30e26e83b2ac5b9e29e1b161e5c1fa7425e73043362938b9824",
      "locator": {
        "type": "text-offset",
        "start": 120,
        "end": 248
      },
      "influence": "primary"
    }
  ],
  "taskCategory": "customer-support/refund",
  "purpose": "customer-support",
  "contextDigest": "sha256:bbbbbbbbbbbbbbbbbbbbbbbbbbbbbbbbbbbbbbbbbbbbbbbbbbbbbbbbbbbbbbbb",
  "occurredAt": "2026-07-15T02:04:00Z",
  "extensions": {},
  "critical": []
}
